{
  "after_digest": "2222222222222222222222222222222222222222222222222222222222222222",
  "backup_digest": "1111111111111111111111111111111111111111111111111111111111111111",
  "backup_path": ".ludowright/backups/migrations/migration-example/state-before.sqlite3",
  "before_digest": "1111111111111111111111111111111111111111111111111111111111111111",
  "completed_at": "2026-07-29T15:00:01.123456Z",
  "database_path": ".ludowright/state.sqlite3",
  "kind": "migration-receipt",
  "migration_ids": [
    "state-v1-to-v2-migration-history"
  ],
  "run_id": "migration-example",
  "schema_version": 1,
  "source_version": 1,
  "started_at": "2026-07-29T15:00:00.123456Z",
  "status": "completed",
  "target_version": 2
}
